{
  "$schema": "http://json-schema.org/draft-07/schema#",
  "$id": "https://hover.dev/schemas/security-seed.json",
  "title": "Hover security-probe seed",
  "description": "A worked recipe that teaches the probe engine how to probe a CAPTURED REQUEST for an access-control or vulnerability bug class. Matched against captured MITM traffic, NOT against UI steps — a separate schema from the optimization (UI-translation) seed. Built-in recipes live as JSON files in packages/probe-engine/seeds/ and are inlined into @hover-dev/api-test / @hover-dev/pentest at build; users add their own under <projectRoot>/.hover/rules/.",
  "type": "object",
  "required": ["name", "class", "match", "probe"],
  "additionalProperties": false,
  "properties": {
    "name": { "type": "string", "minLength": 1, "description": "Identifier, e.g. \"idor-numeric-id\"." },
    "class": {
      "type": "string",
      "enum": ["idor", "bola", "bfla", "mass-assignment", "auth-bypass", "ssrf", "open-redirect", "path-traversal", "cors", "jwt", "sqli", "xss", "ssti", "xxe", "deserialization", "rce", "csrf", "graphql"],
      "description": "Vulnerability class this recipe probes."
    },
    "category": {
      "type": "string",
      "enum": ["authz", "vuln"],
      "default": "authz",
      "description": "Which mode draws this seed: `authz` (business / access-control — orange security mode) or `vuln` (attack / exploit — red pentest mode). Security mode pulls the authz set; pentest mode pulls everything. Defaults to authz when absent."
    },
    "note": { "type": "string", "description": "One-line description of the pattern and when it applies." },
    "match": {
      "type": "object",
      "description": "Cheap relevance filter over a captured request — used only to pick recipes, never exact-matched.",
      "additionalProperties": false,
      "properties": {
        "method": { "type": "array", "items": { "type": "string" }, "description": "HTTP methods this recipe applies to." },
        "urlParam": { "type": "string", "description": "Regex over the request URL / query string." },
        "bodyField": { "type": "string", "description": "Regex over a JSON request-body key." },
        "needsAuth": { "type": "boolean", "description": "Only consider requests that carry a session/auth credential." }
      }
    },
    "probe": {
      "type": "object",
      "required": ["strategy", "signal"],
      "additionalProperties": false,
      "properties": {
        "strategy": { "type": "string", "description": "Human-readable probing strategy the agent follows against the captured request. Keep it IN-BAND — no out-of-band callbacks, no destructive writes unless `destructive` is declared and the user opts in." },
        "secondIdentity": { "type": "boolean", "description": "Requires a second captured identity (B) — replay identity A's request as B." },
        "destructive": {
          "type": "boolean",
          "default": false,
          "description": "Whether the probe issues state-changing/destructive requests. The recipe only DECLARES this; the engine ENFORCES it — destructive probing is off by default and requires explicit user opt-in."
        },
        "signal": { "type": "string", "description": "What response differential indicates a real finding." }
      }
    },
    "assert": { "type": "string", "description": "Optional Playwright request-fixture assertion for a crystallized `.api-test.spec.ts` regression test. Must not bake real cookies/tokens/PII inline — pull credentials from env/fixture." }
  }
}
