{
  "name": "bola-graphql-node",
  "class": "bola",
  "category": "authz",
  "note": "GraphQL relay node(id:) (or any query taking a global object id) fetches an object by id. Substitute ids belonging to another identity to test object-level authorization.",
  "match": {
    "method": ["POST"],
    "urlParam": "/graphql",
    "bodyField": "node\\s*\\(\\s*id:",
    "needsAuth": true
  },
  "probe": {
    "strategy": "Run introspection or read ids from your own results, then issue node(id: \"<other-identity-object>\") as identity B. Test mutations the same way. Global ids are often base64(\"Type:123\") — decode, walk the numeric tail, re-encode.",
    "secondIdentity": true,
    "destructive": false,
    "signal": "node(id:) returns another identity's object, or a mutation accepts another identity's id."
  },
  "assert": "expect(graphqlAsB.data?.node, 'node(id:) must not resolve another identity object').toBeNull();"
}
