{
  "name": "cors-reflected-origin",
  "class": "cors",
  "category": "vuln",
  "note": "An endpoint that reflects the request Origin into Access-Control-Allow-Origin AND allows credentials — any site can then read the authenticated response.",
  "match": {
    "method": ["GET", "POST"],
    "needsAuth": true
  },
  "probe": {
    "strategy": "Replay the request adding Origin: https://evil.example. Inspect Access-Control-Allow-Origin and Access-Control-Allow-Credentials. Reflecting an arbitrary Origin with credentials:true is exploitable; also try Origin: null and trusted-suffix bypasses (evil-trusted.app).",
    "secondIdentity": false,
    "destructive": false,
    "signal": "Access-Control-Allow-Origin reflects the attacker Origin while Allow-Credentials is true."
  },
  "assert": "expect(corsResponse.headers()['access-control-allow-origin'], 'CORS must not reflect an arbitrary Origin').not.toBe('https://evil.example');"
}
