{
  "name": "idor-uuid",
  "class": "idor",
  "category": "authz",
  "note": "Object reference is a UUID/GUID, not a sequential id. You can't increment it — harvest other identities' UUIDs from list/search/feed/notification responses, then replay identity A's request with a harvested id.",
  "match": {
    "method": ["GET", "PUT", "PATCH", "DELETE"],
    "urlParam": "[?&/][0-9a-f]{8}-[0-9a-f]{4}-[0-9a-f]{4}-[0-9a-f]{4}-[0-9a-f]{12}",
    "needsAuth": true
  },
  "probe": {
    "strategy": "Collect UUIDs that belong to other identities from any list/search/feed response the app exposes. Replay identity A's request substituting a UUID owned by B; confirm A cannot read or modify B's object. An unguessable id is not authorization.",
    "secondIdentity": true,
    "destructive": false,
    "signal": "A receives 200 with B's object using a harvested UUID, where 403/404 is expected."
  },
  "assert": "expect(resAsOtherUser.status(), 'a harvested UUID must not grant cross-user access').toBeGreaterThanOrEqual(400);"
}
