{
  "name": "ssrf-url-param",
  "class": "ssrf",
  "category": "vuln",
  "note": "A param that makes the server fetch a URL.",
  "match": {
    "method": ["GET", "POST", "PUT"],
    "urlParam": "[?&](url|uri|next|redirect|callback|target|dest|image_url|webhook|feed|src|domain)=",
    "needsAuth": true
  },
  "probe": {
    "strategy": "Point the value at internal targets (127.0.0.1, 169.254.169.254 metadata, internal ports); confirm IN-BAND via reflected internal content or a timing delta — no external OOB callback.",
    "secondIdentity": false,
    "destructive": false,
    "signal": "The server returns internal/metadata content it should refuse, or a clear timing delta to an internal host."
  },
  "assert": "expect(ssrfProbe.status(), 'server must not fetch internal URLs supplied by the client').toBeGreaterThanOrEqual(400);"
}
