{
  "name": "ssti-template-injection",
  "class": "ssti",
  "category": "vuln",
  "note": "A user-controlled value rendered through a server template engine.",
  "match": {
    "method": ["GET", "POST"],
    "urlParam": "[?&](name|template|page|q|greeting)=",
    "needsAuth": false
  },
  "probe": {
    "strategy": "Send {{7*7}} / ${7*7} / #{7*7}; if the response contains 49, fingerprint the engine ({{7*'7'}} → 7777777 = Jinja2, 49 = Twig) and, in pentest mode only, attempt the engine's class-walker to confirm RCE (read `id`). In-band confirmation.",
    "secondIdentity": false,
    "destructive": false,
    "signal": "A math expression evaluates in the response (49), or command output appears."
  }
}
