{
  "name": "jwt-claim-tamper",
  "class": "jwt",
  "category": "vuln",
  "note": "A JWT/Bearer session whose claims the server may trust without verifying the signature. Tamper a claim (role, sub, tenant) and try the classic signature bypasses.",
  "match": {
    "method": ["GET", "POST", "PUT", "PATCH", "DELETE"],
    "needsAuth": true
  },
  "probe": {
    "strategy": "Decode the JWT and try: alg:none (strip the signature), HS/RS confusion (sign with the public key as the HMAC secret), and editing claims (role:\"admin\", sub:<other-user>, exp far future) while keeping the original signature to see whether it is checked at all.",
    "secondIdentity": false,
    "destructive": false,
    "signal": "A request with a tampered, unverified, or alg:none JWT is accepted as the altered identity/role."
  },
  "assert": "expect(tamperedJwtResponse.status(), 'server must reject a JWT with a tampered or absent signature').toBeGreaterThanOrEqual(400);"
}
