{
  "name": "mass-assignment-privileged-field",
  "class": "mass-assignment",
  "category": "authz",
  "note": "A write endpoint that may bind the body straight onto the model.",
  "match": {
    "method": ["POST", "PUT", "PATCH"],
    "needsAuth": true
  },
  "probe": {
    "strategy": "Add a privileged key the UI never sends (role:\"admin\", isAdmin:true, verified:true); re-fetch and check it took effect.",
    "secondIdentity": false,
    "destructive": true,
    "signal": "A privileged field set only via the API persists on re-fetch."
  },
  "assert": "expect(refetched.role, 'server must ignore client-supplied privileged fields').not.toBe('admin');"
}
